{
  "schema_version": "kspacejet.resolved-pipeline/v1",
  "kind": "ResolvedPipeline",
  "pipeline_definition_artifact_digest": "sha256:cccccccccccccccccccccccccccccccccccccccccccccccccccccccccccccccc",
  "pipeline_definition_semantic_digest": "sha256:dddddddddddddddddddddddddddddddddddddddddddddddddddddddddddddddd",
  "providers": [
    {
      "alias": "reference",
      "provider_id": "org.kspacejet.reference",
      "version": "1.0.0",
      "abi_major": 1,
      "bundle_digest": "sha256:eeeeeeeeeeeeeeeeeeeeeeeeeeeeeeeeeeeeeeeeeeeeeeeeeeeeeeeeeeeeeeee",
      "operators": [
        {
          "id": "reference_reconstruct",
          "interface_revision": "1",
          "contract_digest": "sha256:ffffffffffffffffffffffffffffffffffffffffffffffffffffffffffffffff"
        }
      ]
    }
  ]
}
